{
  "schema_version": 1,
  "id": "m5stack_corep4x",
  "name": "M5CoreP4X",
  "official_name": "M5Stack CoreP4X",
  "official_name_verified": true,
  "aliases": [
    "corep4x",
    "core p4x",
    "p4x"
  ],
  "legacy_board_id": 31,
  "chip": "esp32p4",
  "spec": {
    "display": {
      "resolution": [
        480,
        480
      ],
      "touch": true
    },
    "storage": {
      "psram_mb": 32,
      "sd": true,
      "psram_mode": "opi"
    }
  },
  "pins": {
    "1": {
      "roles": [
        "dev:touch.int"
      ]
    },
    "7": {
      "roles": [
        "bus:sd_spi.mosi",
        "dev:sd.cmd",
        "conn:mbus.7"
      ],
      "verified": {
        "roles": "generated"
      }
    },
    "8": {
      "roles": [
        "bus:sd_spi.miso",
        "dev:sd.d0",
        "conn:mbus.9"
      ],
      "verified": {
        "roles": "generated"
      }
    },
    "9": {
      "roles": [
        "bus:internal_i2c.scl",
        "bus:touch_i2c.scl",
        "conn:mbus.18"
      ],
      "verified": {
        "roles": "generated"
      }
    },
    "10": {
      "roles": [
        "bus:sd_spi.sclk",
        "dev:sd.clk",
        "conn:mbus.11"
      ],
      "verified": {
        "roles": "generated"
      }
    },
    "11": {
      "roles": [
        "bus:internal_i2c.sda",
        "bus:touch_i2c.sda",
        "conn:mbus.17"
      ],
      "verified": {
        "roles": "generated"
      }
    },
    "12": {
      "roles": [
        "conn:mbus.22"
      ],
      "verified": {
        "roles": "generated"
      }
    },
    "14": {
      "roles": [
        "conn:mbus.16"
      ],
      "verified": {
        "roles": "generated"
      }
    },
    "15": {
      "roles": [
        "conn:mbus.15"
      ],
      "verified": {
        "roles": "generated"
      }
    },
    "16": {
      "roles": [
        "bus:port_a_i2c.scl",
        "conn:port_a.1",
        "conn:mbus.20"
      ],
      "verified": {
        "roles": "generated"
      }
    },
    "17": {
      "roles": [
        "conn:mbus.2"
      ],
      "verified": {
        "roles": "generated"
      }
    },
    "18": {
      "roles": [
        "bus:port_a_i2c.sda",
        "conn:port_a.2",
        "conn:mbus.19"
      ],
      "verified": {
        "roles": "generated"
      }
    },
    "19": {
      "roles": [
        "conn:mbus.26"
      ],
      "verified": {
        "roles": "generated"
      }
    },
    "20": {
      "roles": [
        "conn:mbus.4"
      ],
      "verified": {
        "roles": "generated"
      }
    },
    "21": {
      "roles": [
        "conn:mbus.8"
      ],
      "verified": {
        "roles": "generated"
      }
    },
    "22": {
      "roles": [
        "conn:mbus.10"
      ],
      "verified": {
        "roles": "generated"
      }
    },
    "23": {
      "roles": [
        "conn:mbus.24"
      ],
      "verified": {
        "roles": "generated"
      }
    },
    "34": {
      "roles": [
        "conn:mbus.23"
      ],
      "verified": {
        "roles": "generated"
      }
    },
    "37": {
      "roles": [
        "conn:mbus.14"
      ],
      "verified": {
        "roles": "generated"
      }
    },
    "38": {
      "roles": [
        "conn:mbus.13"
      ],
      "verified": {
        "roles": "generated"
      }
    },
    "39": {
      "roles": [
        "conn:mbus.21"
      ],
      "verified": {
        "roles": "generated"
      }
    },
    "50": {
      "roles": [
        "dev:sd.d3"
      ],
      "verified": {
        "roles": "generated"
      }
    }
  },
  "buses": {
    "display_dsi": {
      "kind": "dsi",
      "signals": [],
      "preferred_host": 0,
      "lane_num": 2,
      "freq": 600,
      "ldo_chan_id": 3,
      "ldo_voltage_mv": 2500,
      "fixed": true
    },
    "internal_i2c": {
      "kind": "i2c",
      "signals": [
        "sda",
        "scl"
      ],
      "preferred_host": 1,
      "freq": 100000,
      "fixed": true,
      "verified": {
        "signals": "generated",
        "preferred_host": "generated",
        "freq": "generated"
      }
    },
    "touch_i2c": {
      "kind": "i2c",
      "signals": [
        "sda",
        "scl"
      ],
      "preferred_host": 1,
      "freq": 400000,
      "fixed": true,
      "verified": {
        "signals": "generated",
        "preferred_host": "generated",
        "freq": "generated"
      }
    },
    "port_a_i2c": {
      "kind": "i2c",
      "signals": [
        "sda",
        "scl"
      ],
      "preferred_host": 1,
      "fixed": true,
      "verified": {
        "signals": "generated",
        "preferred_host": "generated"
      }
    },
    "sd_spi": {
      "kind": "spi",
      "signals": [
        "sclk",
        "mosi",
        "miso"
      ],
      "preferred_host": "SPI2_HOST",
      "fixed": false,
      "freq": 40000000,
      "freq_read": 16000000,
      "verified": {
        "signals": "generated",
        "preferred_host": "generated",
        "freq": "generated",
        "freq_read": "generated"
      }
    }
  },
  "devices": {
    "lcd": {
      "kind": "display",
      "part": "st7102",
      "bus": "display_dsi",
      "spec": {
        "width": 480,
        "height": 480,
        "memory_width": 480,
        "memory_height": 480,
        "rotation_offset": 2,
        "readable": false,
        "rgb_order": true,
        "dpi_freq_mhz": 24,
        "hsync_back_porch": 40,
        "hsync_pulse_width": 2,
        "hsync_front_porch": 40,
        "vsync_back_porch": 8,
        "vsync_pulse_width": 4,
        "vsync_front_porch": 200
      }
    },
    "touch": {
      "kind": "touch",
      "part": "cst3530",
      "bus": "touch_i2c",
      "spec": {
        "x_max": 479,
        "y_max": 479,
        "rotation_offset": 2
      }
    },
    "pmic": {
      "kind": "pmic",
      "part": "m5pm1",
      "bus": "internal_i2c"
    },
    "ioe": {
      "kind": "io_expander",
      "part": "m5ioe1",
      "bus": "internal_i2c"
    },
    "sd": {
      "kind": "sd",
      "part": "sd_slot",
      "bus": "sd_spi",
      "verified": {
        "bus": "generated"
      }
    },
    "psram": {
      "kind": "psram",
      "part": "psram"
    }
  },
  "connectors": {
    "port_a": {
      "type": "hy2_4p",
      "standard": "port_i2c"
    },
    "mbus": {
      "type": "mbus"
    }
  }
}
