{
  "schema_version": 1,
  "id": "m5nanoc6",
  "name": "M5NanoC6",
  "official_name": "M5Stack NanoC6",
  "legacy_board_id": 140,
  "chip": "esp32c6",
  "spec": {
    "links": {
      "product": "https://docs.m5stack.com/en/core/NanoC6",
      "verified": {
        "product": "datasheet",
        "schematic": "datasheet"
      },
      "schematic": "https://m5stack-doc.oss-cn-shenzhen.aliyuncs.com/505/Sch_M5NanoC6_v0.0.1.pdf"
    }
  },
  "pins": {
    "1": {
      "roles": [
        "conn:port_a.1"
      ],
      "verified": {
        "roles": "generated"
      }
    },
    "2": {
      "roles": [
        "conn:port_a.2"
      ],
      "verified": {
        "roles": "generated"
      }
    },
    "3": {
      "roles": [
        "dev:ir_led.on"
      ],
      "note": "IR LED clamps the internal pull-up low",
      "verified": {
        "roles": "measured"
      },
      "measured_by": {
        "roles": "docs/investigations/nano-c6-h2-pins-2026-09-28.md"
      }
    }
  },
  "buses": {},
  "devices": {
    "ir_led": {
      "kind": "led"
    }
  },
  "connectors": {
    "port_a": {
      "type": "hy2_4p",
      "standard": "port_i2c",
      "note": "Product marking PORT.CUSTOM; registered as port_a because M5Unified external I2C uses GPIO1 (SCL)/GPIO2 (SDA)."
    }
  }
}
