{
  "schema_version": 1,
  "id": "m5atoms3lite",
  "name": "M5AtomS3Lite",
  "official_name": "M5Stack AtomS3-Lite",
  "official_name_verified": true,
  "legacy_board_id": 137,
  "chip": "esp32s3",
  "spec": {
    "links": {
      "product": "https://docs.m5stack.com/en/core/AtomS3-Lite",
      "schematic": "https://m5stack-doc.oss-cn-shenzhen.aliyuncs.com/471/Sch_M5_AtomS3_v1.0.pdf",
      "verified": {
        "product": "datasheet",
        "schematic": "datasheet"
      }
    }
  },
  "pins": {
    "1": {
      "roles": [
        "bus:port_a_i2c.scl",
        "conn:port_a.1"
      ],
      "verified": {
        "roles": "generated"
      }
    },
    "2": {
      "roles": [
        "bus:port_a_i2c.sda",
        "conn:port_a.2"
      ],
      "verified": {
        "roles": "generated"
      }
    },
    "4": {
      "roles": [
        "dev:ir_led.on"
      ]
    },
    "5": {
      "roles": [
        "conn:rear_left.2"
      ],
      "verified": {
        "roles": "datasheet"
      }
    },
    "6": {
      "roles": [
        "conn:rear_left.3"
      ],
      "verified": {
        "roles": "datasheet"
      }
    },
    "7": {
      "roles": [
        "conn:rear_left.4"
      ],
      "verified": {
        "roles": "datasheet"
      }
    },
    "8": {
      "roles": [
        "conn:rear_left.5"
      ],
      "verified": {
        "roles": "datasheet"
      }
    },
    "12": {
      "roles": []
    },
    "16": {
      "roles": []
    },
    "35": {
      "roles": [
        "dev:rgb_led.data"
      ],
      "verified": {
        "roles": "generated"
      }
    },
    "38": {
      "roles": [
        "bus:internal_i2c.sda",
        "conn:rear_right.2"
      ],
      "verified": {
        "roles": "generated"
      }
    },
    "39": {
      "roles": [
        "bus:internal_i2c.scl",
        "conn:rear_right.1"
      ],
      "verified": {
        "roles": "generated"
      }
    },
    "41": {
      "roles": [
        "dev:btn_a.in"
      ]
    }
  },
  "buses": {
    "internal_i2c": {
      "kind": "i2c",
      "signals": [
        "sda",
        "scl"
      ],
      "preferred_host": 1,
      "fixed": false,
      "verified": {
        "signals": "generated",
        "preferred_host": "generated"
      }
    },
    "port_a_i2c": {
      "kind": "i2c",
      "signals": [
        "sda",
        "scl"
      ],
      "preferred_host": 0,
      "fixed": false,
      "verified": {
        "signals": "generated",
        "preferred_host": "generated"
      }
    }
  },
  "devices": {
    "rgb_led": {
      "kind": "led_strip",
      "signals": {
        "data": "gpio:35"
      },
      "verified": {
        "signals": "generated"
      }
    },
    "btn_a": {
      "kind": "button",
      "part": "button",
      "spec": {
        "active_low": true,
        "pull": "external_up"
      },
      "signals": {
        "in": "gpio:41"
      },
      "verified": {
        "signals": "generated"
      }
    },
    "ir_led": {
      "kind": "led",
      "signals": {
        "on": "gpio:4"
      }
    }
  },
  "connectors": {
    "port_a": {
      "type": "hy2_4p",
      "standard": "port_i2c",
      "positions": {
        "1": "gpio:1",
        "2": "gpio:2",
        "3": "pwr:5v",
        "4": "pwr:gnd"
      },
      "verified": {
        "positions": "datasheet"
      }
    },
    "rear_left": {
      "type": "socket_1x5_254",
      "positions": {
        "1": "pwr:3v3",
        "2": "gpio:5",
        "3": "gpio:6",
        "4": "gpio:7",
        "5": "gpio:8"
      },
      "note": "Rear left socket viewed from the bottom with USB at the bottom; positions numbered top to bottom.",
      "verified": {
        "type": "datasheet",
        "positions": "datasheet"
      }
    },
    "rear_right": {
      "type": "socket_1x4_254",
      "positions": {
        "1": "gpio:39",
        "2": "gpio:38",
        "3": "pwr:5v",
        "4": "pwr:gnd"
      },
      "note": "Rear right socket in the same bottom view; positions numbered top to bottom.",
      "verified": {
        "type": "datasheet",
        "positions": "datasheet"
      }
    }
  }
}
