{
  "schema_version": 1,
  "id": "m5unit_c6l",
  "name": "M5UnitC6L",
  "official_name": "M5Stack Unit C6L",
  "official_name_verified": true,
  "aliases": [
    "unitc6l",
    "unit c6l",
    "c6l",
    "c6l unit",
    "meshtastic"
  ],
  "legacy_board_id": 25,
  "chip": "esp32c6",
  "spec": {
    "display": {
      "resolution": [
        64,
        48
      ],
      "touch": false
    },
    "links": {
      "product": "https://docs.m5stack.com/en/unit/Unit_C6L",
      "verified": {
        "product": "datasheet",
        "schematic": "datasheet"
      },
      "schematic": "https://m5stack-doc.oss-cn-shenzhen.aliyuncs.com/1185/SCH_Unit_C6L_SCH_B0.4.1_20250827_2025_09_02_15_04_22.pdf"
    }
  },
  "pins": {
    "2": {
      "roles": [
        "dev:power_hold.enable"
      ],
      "verified": {
        "roles": "generated"
      }
    },
    "4": {
      "roles": [
        "conn:port_b.1",
        "conn:port_c.1"
      ],
      "verified": {
        "roles": "generated"
      }
    },
    "5": {
      "roles": [
        "conn:port_b.2",
        "conn:port_c.2"
      ],
      "verified": {
        "roles": "generated"
      }
    },
    "6": {
      "roles": [
        "dev:oled.cs"
      ]
    },
    "8": {
      "roles": [
        "bus:internal_i2c.scl"
      ],
      "verified": {
        "roles": "generated"
      }
    },
    "10": {
      "roles": [
        "bus:internal_i2c.sda"
      ],
      "verified": {
        "roles": "generated"
      }
    },
    "15": {
      "roles": [
        "dev:oled.rst"
      ]
    },
    "18": {
      "roles": [
        "dev:oled.dc"
      ],
      "note": "Board-family pull signature input when the OLED is deselected"
    },
    "20": {
      "roles": [
        "bus:main_spi.sclk"
      ],
      "verified": {
        "roles": "generated"
      }
    },
    "21": {
      "roles": [
        "bus:main_spi.mosi"
      ],
      "verified": {
        "roles": "generated"
      }
    },
    "22": {
      "roles": [
        "bus:main_spi.miso"
      ],
      "note": "Legacy setup routes this NC signal as MISO",
      "verified": {
        "roles": "generated"
      }
    }
  },
  "buses": {
    "main_spi": {
      "kind": "spi",
      "signals": [
        "sclk",
        "mosi",
        "miso"
      ],
      "preferred_host": "SPI2_HOST",
      "fixed": false,
      "freq": 40000000,
      "freq_read": 10000000,
      "verified": {
        "signals": "generated",
        "preferred_host": "generated",
        "freq": "generated",
        "freq_read": "generated"
      }
    },
    "internal_i2c": {
      "kind": "i2c",
      "signals": [
        "sda",
        "scl"
      ],
      "preferred_host": 0,
      "fixed": false,
      "freq": 100000,
      "verified": {
        "signals": "generated",
        "preferred_host": "generated",
        "freq": "generated"
      }
    }
  },
  "devices": {
    "oled": {
      "kind": "display",
      "part": "ssd1306",
      "bus": "main_spi",
      "spec": {
        "width": 64,
        "height": 48,
        "offset_x": 32,
        "offset_y": 0,
        "rotation_offset": 0,
        "readable": true,
        "three_wire": true
      }
    },
    "power_hold": {
      "kind": "power_hold",
      "spec": {
        "active_low": false
      }
    },
    "ioe": {
      "kind": "io_expander",
      "part": "pi4io",
      "bus": "internal_i2c",
      "i2c_addr": "0x43",
      "pins": {
        "p0": {
          "roles": [
            "dev:btn_a.in"
          ]
        }
      }
    },
    "btn_a": {
      "kind": "button",
      "part": "button",
      "spec": {
        "active_low": true,
        "pull": "internal_up"
      }
    }
  },
  "connectors": {
    "port_b": {
      "type": "hy2_4p",
      "standard": "port_io",
      "note": "The product has one physical socket marked PORT.A (white GPIO4/yellow GPIO5). M5Unified assigns this pair to both port_b and port_c; these are library contracts for the same socket."
    },
    "port_c": {
      "type": "hy2_4p",
      "standard": "port_uart",
      "note": "The product has one physical socket marked PORT.A (white GPIO4/yellow GPIO5). M5Unified assigns this pair to both port_b and port_c; these are library contracts for the same socket."
    }
  }
}
