{
  "schema_version": 1,
  "id": "m5atomlite",
  "name": "M5AtomLite",
  "official_name": "M5Stack Atom-Lite",
  "official_name_verified": true,
  "legacy_board_id": 128,
  "chip": "esp32_d0wdq6",
  "spec": {
    "links": {
      "product": "https://docs.m5stack.com/en/core/Atom-Lite",
      "schematic": "https://static-cdn.m5stack.com/resource/docs/products/core/ATOM%20Lite/img-2e58eac3-d9ef-4be4-b486-d4dd9a8324fa.webp",
      "verified": {
        "product": "datasheet",
        "schematic": "datasheet"
      }
    }
  },
  "pins": {
    "12": {
      "roles": [
        "dev:ir.pwm"
      ],
      "note": "IR transmitter GPIO from the official pin map."
    },
    "18": {
      "roles": [],
      "note": "Unconnected GPIO sampled by the Atom family exclusion gate."
    },
    "19": {
      "roles": [
        "conn:rear_left.3"
      ],
      "verified": {
        "roles": "datasheet"
      }
    },
    "21": {
      "roles": [
        "bus:internal_i2c.scl",
        "conn:rear_right.1"
      ],
      "verified": {
        "roles": "generated"
      }
    },
    "22": {
      "roles": [
        "conn:rear_left.2"
      ],
      "verified": {
        "roles": "datasheet"
      }
    },
    "23": {
      "roles": [
        "conn:rear_left.4"
      ],
      "verified": {
        "roles": "datasheet"
      }
    },
    "25": {
      "roles": [
        "bus:internal_i2c.sda",
        "conn:rear_right.2"
      ],
      "verified": {
        "roles": "generated"
      }
    },
    "26": {
      "roles": [
        "conn:port_a.2"
      ],
      "verified": {
        "roles": "generated"
      }
    },
    "27": {
      "roles": [
        "dev:rgb_led.data"
      ],
      "verified": {
        "roles": "generated"
      }
    },
    "32": {
      "roles": [
        "conn:port_a.1"
      ],
      "verified": {
        "roles": "generated"
      }
    },
    "33": {
      "roles": [
        "conn:rear_left.5"
      ],
      "verified": {
        "roles": "datasheet"
      }
    }
  },
  "buses": {
    "internal_i2c": {
      "kind": "i2c",
      "signals": [
        "sda",
        "scl"
      ],
      "preferred_host": 1,
      "fixed": false,
      "verified": {
        "signals": "generated",
        "preferred_host": "generated"
      }
    }
  },
  "devices": {
    "rgb_led": {
      "kind": "led_strip"
    },
    "ir": {
      "kind": "led"
    }
  },
  "connectors": {
    "port_a": {
      "type": "hy2_4p",
      "standard": "port_i2c",
      "positions": {
        "3": "pwr:5v"
      },
      "verified": {
        "positions": "datasheet"
      }
    },
    "rear_left": {
      "type": "socket_1x5_254",
      "positions": {
        "1": "pwr:3v3"
      },
      "note": "Rear left socket viewed from the bottom with USB at the bottom; positions numbered top to bottom.",
      "verified": {
        "type": "datasheet",
        "positions": "datasheet"
      }
    },
    "rear_right": {
      "type": "socket_1x4_254",
      "positions": {
        "3": "pwr:5v",
        "4": "pwr:gnd"
      },
      "note": "Rear right socket in the same bottom view; positions numbered top to bottom.",
      "verified": {
        "type": "datasheet",
        "positions": "datasheet"
      }
    }
  }
}
