{
  "schema_version": 1,
  "id": "m5atomvoice",
  "name": "M5AtomVoice",
  "official_name": "M5Stack AtomVoice",
  "legacy_board_id": 142,
  "chip": "esp32_d0wdq6",
  "spec": {
    "links": {
      "product": "https://docs.m5stack.com/en/atom/atomecho",
      "schematic": "https://static-cdn.m5stack.com/resource/docs/products/atom/atomecho/atomecho_sch_01.webp",
      "verified": {
        "product": "datasheet",
        "schematic": "datasheet"
      }
    }
  },
  "pins": {
    "19": {
      "roles": [
        "conn:rear_left.3"
      ],
      "verified": {
        "roles": "datasheet",
        "note": "datasheet"
      },
      "note": "GPIO19/22/23/33 are reserved for the internal audio interface. The official documentation prohibits external reuse, expansion modules, or additional wiring on these pins."
    },
    "21": {
      "roles": [
        "bus:internal_i2c.scl",
        "conn:rear_right.1"
      ],
      "verified": {
        "roles": "generated"
      }
    },
    "22": {
      "roles": [
        "conn:rear_left.2"
      ],
      "verified": {
        "roles": "datasheet",
        "note": "datasheet"
      },
      "note": "GPIO19/22/23/33 are reserved for the internal audio interface. The official documentation prohibits external reuse, expansion modules, or additional wiring on these pins."
    },
    "23": {
      "roles": [
        "conn:rear_left.4"
      ],
      "verified": {
        "roles": "datasheet",
        "note": "datasheet"
      },
      "note": "GPIO19/22/23/33 are reserved for the internal audio interface. The official documentation prohibits external reuse, expansion modules, or additional wiring on these pins."
    },
    "25": {
      "roles": [
        "bus:internal_i2c.sda",
        "conn:rear_right.2"
      ],
      "verified": {
        "roles": "generated"
      }
    },
    "26": {
      "roles": [
        "conn:port_a.2"
      ],
      "verified": {
        "roles": "generated"
      }
    },
    "27": {
      "roles": [
        "dev:rgb_led.data"
      ],
      "verified": {
        "roles": "generated"
      }
    },
    "32": {
      "roles": [
        "conn:port_a.1"
      ],
      "verified": {
        "roles": "generated"
      }
    },
    "33": {
      "roles": [
        "conn:rear_left.5"
      ],
      "verified": {
        "roles": "datasheet",
        "note": "datasheet"
      },
      "note": "GPIO19/22/23/33 are reserved for the internal audio interface. The official documentation prohibits external reuse, expansion modules, or additional wiring on these pins."
    }
  },
  "buses": {
    "internal_i2c": {
      "kind": "i2c",
      "signals": [
        "sda",
        "scl"
      ],
      "preferred_host": 1,
      "fixed": false,
      "verified": {
        "signals": "generated",
        "preferred_host": "generated"
      }
    }
  },
  "devices": {
    "rgb_led": {
      "kind": "led_strip",
      "signals": {
        "data": "gpio:27"
      },
      "verified": {
        "signals": "generated"
      }
    }
  },
  "connectors": {
    "port_a": {
      "type": "hy2_4p",
      "standard": "port_i2c",
      "positions": {
        "1": "gpio:32",
        "2": "gpio:26",
        "3": "pwr:5v",
        "4": "pwr:gnd"
      },
      "verified": {
        "positions": "datasheet"
      }
    },
    "rear_left": {
      "type": "socket_1x5_254",
      "positions": {
        "1": "pwr:3v3",
        "2": "gpio:22",
        "3": "gpio:19",
        "4": "gpio:23",
        "5": "gpio:33"
      },
      "note": "Rear left socket viewed from the bottom with USB at the bottom; positions numbered top to bottom. GPIO19/22/23/33 are reserved for the internal audio interface. The official documentation prohibits external reuse, expansion modules, or additional wiring on these pins.",
      "verified": {
        "type": "datasheet",
        "positions": "datasheet"
      }
    },
    "rear_right": {
      "type": "socket_1x4_254",
      "positions": {
        "1": "gpio:21",
        "2": "gpio:25",
        "3": "pwr:5v",
        "4": "pwr:gnd"
      },
      "note": "Rear right socket in the same bottom view; positions numbered top to bottom.",
      "verified": {
        "type": "datasheet",
        "positions": "datasheet"
      }
    }
  }
}
