{
  "schema_version": 1,
  "id": "m5atoms3rcam",
  "name": "M5AtomS3RCam",
  "official_name": "M5Stack M5AtomS3RCam",
  "legacy_board_id": 144,
  "chip": "esp32s3",
  "spec": {
    "links": {
      "product": "https://docs.m5stack.com/en/core/AtomS3R%20Cam",
      "schematic": "https://m5stack-doc.oss-cn-shenzhen.aliyuncs.com/681/main_board_schematic.pdf",
      "verified": {
        "product": "datasheet",
        "schematic": "datasheet"
      }
    }
  },
  "pins": {
    "0": {
      "roles": [
        "bus:internal_i2c.scl"
      ],
      "verified": {
        "roles": "generated"
      }
    },
    "1": {
      "roles": [
        "bus:port_a_i2c.scl",
        "conn:port_a.1"
      ],
      "verified": {
        "roles": "generated"
      }
    },
    "2": {
      "roles": [
        "bus:port_a_i2c.sda",
        "conn:port_a.2"
      ],
      "verified": {
        "roles": "generated"
      }
    },
    "5": {
      "roles": [
        "conn:rear_left.2"
      ],
      "verified": {
        "roles": "datasheet"
      }
    },
    "6": {
      "roles": [
        "conn:rear_left.3"
      ],
      "verified": {
        "roles": "datasheet"
      }
    },
    "7": {
      "roles": [
        "conn:rear_left.4"
      ],
      "verified": {
        "roles": "datasheet"
      }
    },
    "8": {
      "roles": [
        "conn:rear_left.5"
      ],
      "verified": {
        "roles": "datasheet"
      }
    },
    "9": {
      "roles": []
    },
    "12": {
      "roles": []
    },
    "18": {
      "roles": []
    },
    "21": {
      "roles": []
    },
    "38": {
      "roles": [
        "conn:rear_right.2"
      ],
      "verified": {
        "roles": "datasheet"
      }
    },
    "39": {
      "roles": [
        "conn:rear_right.1"
      ],
      "verified": {
        "roles": "datasheet"
      }
    },
    "45": {
      "roles": [
        "bus:internal_i2c.sda"
      ],
      "verified": {
        "roles": "generated"
      }
    }
  },
  "buses": {
    "internal_i2c": {
      "kind": "i2c",
      "signals": [
        "sda",
        "scl"
      ],
      "preferred_host": 1,
      "fixed": false,
      "verified": {
        "signals": "generated",
        "preferred_host": "generated"
      }
    },
    "port_a_i2c": {
      "kind": "i2c",
      "signals": [
        "sda",
        "scl"
      ],
      "preferred_host": 0,
      "fixed": false,
      "verified": {
        "signals": "generated",
        "preferred_host": "generated"
      }
    }
  },
  "devices": {
    "imu": {
      "kind": "imu",
      "part": "bmi270",
      "bus": "internal_i2c",
      "i2c_addr": "0x68"
    }
  },
  "connectors": {
    "port_a": {
      "type": "hy2_4p",
      "standard": "port_i2c",
      "positions": {
        "3": "pwr:5v"
      },
      "verified": {
        "positions": "datasheet"
      }
    },
    "rear_left": {
      "type": "socket_1x5_254",
      "positions": {
        "1": "pwr:3v3"
      },
      "note": "Rear left socket viewed from the bottom with USB at the bottom; positions numbered top to bottom.",
      "verified": {
        "type": "datasheet",
        "positions": "datasheet"
      }
    },
    "rear_right": {
      "type": "socket_1x4_254",
      "positions": {
        "3": "pwr:5v",
        "4": "pwr:gnd"
      },
      "note": "Rear right socket in the same bottom view; positions numbered top to bottom.",
      "verified": {
        "type": "datasheet",
        "positions": "datasheet"
      }
    }
  }
}
